{
  "profileId": "grom_internal",
  "version": "1.0.0",
  "targetKind": "location",
  "excludedCapabilities": [
    "courses",
    "lessons",
    "course_offers",
    "course_progress",
    "memberships",
    "communities",
    "assessments",
    "certificates",
    "course_credentials"
  ],
  "journeys": [
    {
      "journeyId": "agency_new_business",
      "journeyInstanceId": "journey_agency_new_business",
      "entryRule": "enquiry_created",
      "denominator": "enquiry_created",
      "outcomes": [
        "won",
        "lost",
        "collected_revenue"
      ]
    },
    {
      "journeyId": "client_onboarding",
      "journeyInstanceId": "journey_client_onboarding",
      "entryRule": "won_or_paid_handoff",
      "denominator": "won_or_paid_handoff",
      "outcomes": [
        "launch",
        "first_value"
      ]
    }
  ],
  "situation": {
    "accountName": "GROM Digital UK",
    "whoThisIs": "Grom Digital, a UK marketing agency selling done-for-you patient acquisition to aesthetic and cosmetic clinics. Founder-led sales calls.",
    "howLeadsArrive": "Meta (Facebook and Instagram) lead-form ads. The lead never visits a website first, so the email address is pre-filled from their Facebook profile and is often a secondary or dormant inbox.",
    "whatIsSold": "The Pilot Program: free for 30 days, the client pays on results. A signed client is TRIALING before any money moves, and there is no upfront fee to object to.",
    "theFunnel": "enquiry -> conversation -> booked Clinic Growth Strategy Session with a founder -> attended -> signed agreement -> 30-day trial -> paying",
    "objective": "Engagement, booking, attendance AND conversion, judged on money earned. In the owner's words: we want people to be engaged, but not only engage, convert as well.",
    "knownDataCaveats": [
      "This pipeline marks an opportunity `won` ONLY once the client PAYS. There is no stage for closed-and-trialing, so signed clients sit in `open` indefinitely. A zero win count NEVER means nothing closed, and `showed_to_decision` reading zero is the same artefact.",
      "After a client signs, the work of onboarding them happens in a separate portal, not in this system. So eleven of the journey steps this system declares, everything from the internal handoff onward, will always read as unmeasurable here. That is not a gap in the account and it is not a finding: the events simply happen somewhere else.",
      "Nothing records the moment a lead becomes qualified, so `contacted_to_qualified` and `qualified_to_strategy_call` have no signal at all.",
      "This system is DESIGNED to handle leads with automation and AI, and its AI books more appointments than any other route. Inserting a human is not a generic fix here and must be argued from the evidence if argued at all.",
      "The Voice AI agent named VOKI, business name Voksica, is a TEST agent and is not part of this business. Owner confirmed 2026-07-28. Its script, its Make.com webhook actions and its physiotherapy framing are all deliberate scratch work, so none of that is a finding. What WOULD be a finding is VOKI having inbound calling switched on, or a workflow or calendar routing real contacts to it: check isInboundActive before dismissing anything about it.",
      "PLANNED, NOT BUILT: the onboarding AI assistant in the client portal (Hana) is intended to send clients a DAILY onboarding update. Owner confirmed 2026-07-28. So the delivery-side comms gap this account shows is being addressed outside this system, and a recommendation to add more GHL email chases to the onboarding ladders is probably the wrong fix. What IS still a fair finding on the delivery side: a chase that threatens a sanction nothing carries out, a ladder with no ending, copy that contradicts the sales promise, and anything a daily update would not fix.",
      "AN APPOINTMENT OUTCOME CANNOT BE AUTOMATED. Owner confirmed 2026-07-28: whether a meeting was attended or missed is set by the person who was IN the meeting, an executive, by hand. So do not propose a workflow that writes it. The honest fix for the 22 unresolved appointments is an internal notification asking that person to close them out, and the finding that the outcome is unrecorded remains true and important because every attendance number depends on it.",
      "SENDING THE CONTRACT IS A DELIBERATE HUMAN DECISION. Owner confirmed 2026-07-28: an executive runs the strategy call, qualifies the client on the call, and sends the contract only if they agree. There is no automated path from a call to a contract and there should not be one, so an apparent gap between the strategy stage and the contract stage is the process working.",
      "07 Send Contract and 07.5 Contract Signed share a trigger TYPE and not a trigger. Owner confirmed 2026-07-28: 07 fires when the document is SENT, 07.5 when it is SIGNED or accepted. Any claim that these two race, or that a signed client is chased for a signature, must be argued from the trigger FILTERS on each workflow and never from the shared type alone.",
      "PLANNED, NOT BUILT: a reactivation sequence for leads who finish the nurture ladder without booking. Owner confirmed 2026-07-28. So the absence of anything after the ladder ends is known and being worked on, and recommending that it exist adds nothing.",
      "AN OPPORTUNITY WITH NO MONETARY VALUE IS NOT AN OVERSIGHT. Owner confirmed 2026-07-28: every client gets a custom offer priced after the trial ends, so a value cannot honestly be set at the point the opportunity is created. It still means revenue is UNMEASURABLE rather than zero, and a per-client figure entered once the offer is agreed would fix that."
    ],
    "targets": [
      {
        "edgeId": "enquiry_to_contacted",
        "target": 0.98,
        "standard": "industry_typical",
        "basis": "This system contacts every enquiry by automation, so anything short of near-total coverage is a delivery or enrolment failure rather than a sales result. Speed matters more than coverage here: published data puts close rates at 32% when the first reply lands inside five minutes against 12% at 24 hours, and the average business takes 42 hours."
      },
      {
        "edgeId": "strategy_call_to_showed",
        "target": 0.65,
        "standard": "industry_typical",
        "basis": "Normal band for a FREE B2B discovery call is 50 to 70 percent, and 65 is the middle of it. Owner chose normal deliberately on 2026-07-28. The same research puts a paid or deposit-backed call at 85 percent, so raising this target is a product decision about charging for the call, not a marketing one."
      },
      {
        "edgeId": "showed_to_decision",
        "target": 0.35,
        "standard": "industry_typical",
        "basis": "About 35 percent of shown high-ticket B2B discovery calls close, and first-meeting-to-opportunity runs 30 to 50 percent where discovery is sharp. Read this against the caveat that this pipeline only marks won once the client PAYS."
      }
    ]
  },
  "questionEdges": [
    {
      "question": 1,
      "edgeIds": [
        "enquiry_to_contacted",
        "contacted_to_qualified"
      ]
    },
    {
      "question": 2,
      "edgeIds": [
        "contacted_to_qualified"
      ]
    },
    {
      "question": 3,
      "edgeIds": [
        "qualified_to_strategy_call"
      ]
    },
    {
      "question": 4,
      "edgeIds": [
        "strategy_call_to_showed"
      ]
    },
    {
      "question": 5,
      "edgeIds": []
    },
    {
      "question": 6,
      "edgeIds": [
        "showed_to_decision",
        "showed_to_decision_30d",
        "won_to_collected_revenue"
      ]
    }
  ]
}
